[
    {
        "molecule_name": "mIL-31-CEE",
        "protein_target_name": "IL-31",
        "protein_uniprot_id": null,
        "protein_seq_id": "271.9.4.2.6",
        "binding_metric": "IC50",
        "value": "13",
        "unit": "ng/mL",
        "raw_mentions": "Here are the extracted sentences/rows that meet the criteria:\n\n\nmIL-31 version of mIL-31 supporting the conclusion from the epitope binning studies that this antibody in all likelihood has a different epitope specificity than the other four mAbs, with IC50 values determined using Softmax software (Molecular Devices).\nTABLE 1In Vitro Cell-Based Neutralization Activity of Rat Anti-Mouse IL-31 MAbsmIL-31Conc.IC50 (ng/mL) for mAbsversion(ng/mL)271.9.4.2.6271.26.6.6.1271.33.1.2.2271.33.3.2.1271.39.4.6.5mIL31-CEE1113213253014133612c108smIL311961171248951904333255140\n\n\nHowever, I realized that the table row is more relevant, so I will reformat it to include only the relevant rows:\n\n\nmIL31-CEE1    13    21    32    50    14\nc108smIL31    19    61    17    124    89 \nmIL31-CEE1    13    21    32    50    14\nc108smIL31    19    61    17    124    89 \nmIL31-CEE1    12    13    25    30    14\nc108smIL31    33    25    140    95    40 \n\n\nLet me reformat it again to make it clear:\n\n\nmIL-31-CEE, 271.9.4.2.6, IC50: 13 ng/mL\nmIL-31-CEE, 271.26.6.6.1, IC50: 21 ng/mL\nmIL-31-CEE, 271.33.1.2.2, IC50: 32 ng/mL\nmIL-31-CEE, 271.33.3.2.1, IC50: 50 ng/mL\nmIL-31-CEE, 271.39.4.6.5, IC50: 14 ng/mL\nc108smIL-31, 271.9.4.2.6, IC50: 19 ng/mL\nc108smIL-31, 271.26.6.6.1, IC50: 61 ng/mL\nc108smIL-31, 271.33.1.2.2, IC50: 17 ng/mL\nc108smIL-31, 271.33.3.2.1, IC50: 124 ng/mL\nc108smIL-31, 271.39.4.6.5, IC50: 89 ng/mL"
    },
    {
        "molecule_name": "mIL-31-CEE",
        "protein_target_name": "IL-31",
        "protein_uniprot_id": null,
        "protein_seq_id": "271.26.6.6.1",
        "binding_metric": "IC50",
        "value": "21",
        "unit": "ng/mL",
        "raw_mentions": "Here are the extracted sentences/rows that meet the criteria:\n\n\nmIL-31 version of mIL-31 supporting the conclusion from the epitope binning studies that this antibody in all likelihood has a different epitope specificity than the other four mAbs, with IC50 values determined using Softmax software (Molecular Devices).\nTABLE 1In Vitro Cell-Based Neutralization Activity of Rat Anti-Mouse IL-31 MAbsmIL-31Conc.IC50 (ng/mL) for mAbsversion(ng/mL)271.9.4.2.6271.26.6.6.1271.33.1.2.2271.33.3.2.1271.39.4.6.5mIL31-CEE1113213253014133612c108smIL311961171248951904333255140\n\n\nHowever, I realized that the table row is more relevant, so I will reformat it to include only the relevant rows:\n\n\nmIL31-CEE1    13    21    32    50    14\nc108smIL31    19    61    17    124    89 \nmIL31-CEE1    13    21    32    50    14\nc108smIL31    19    61    17    124    89 \nmIL31-CEE1    12    13    25    30    14\nc108smIL31    33    25    140    95    40 \n\n\nLet me reformat it again to make it clear:\n\n\nmIL-31-CEE, 271.9.4.2.6, IC50: 13 ng/mL\nmIL-31-CEE, 271.26.6.6.1, IC50: 21 ng/mL\nmIL-31-CEE, 271.33.1.2.2, IC50: 32 ng/mL\nmIL-31-CEE, 271.33.3.2.1, IC50: 50 ng/mL\nmIL-31-CEE, 271.39.4.6.5, IC50: 14 ng/mL\nc108smIL-31, 271.9.4.2.6, IC50: 19 ng/mL\nc108smIL-31, 271.26.6.6.1, IC50: 61 ng/mL\nc108smIL-31, 271.33.1.2.2, IC50: 17 ng/mL\nc108smIL-31, 271.33.3.2.1, IC50: 124 ng/mL\nc108smIL-31, 271.39.4.6.5, IC50: 89 ng/mL"
    },
    {
        "molecule_name": "mIL-31-CEE",
        "protein_target_name": "IL-31",
        "protein_uniprot_id": null,
        "protein_seq_id": "271.33.1.2.2",
        "binding_metric": "IC50",
        "value": "32",
        "unit": "ng/mL",
        "raw_mentions": "Here are the extracted sentences/rows that meet the criteria:\n\n\nmIL-31 version of mIL-31 supporting the conclusion from the epitope binning studies that this antibody in all likelihood has a different epitope specificity than the other four mAbs, with IC50 values determined using Softmax software (Molecular Devices).\nTABLE 1In Vitro Cell-Based Neutralization Activity of Rat Anti-Mouse IL-31 MAbsmIL-31Conc.IC50 (ng/mL) for mAbsversion(ng/mL)271.9.4.2.6271.26.6.6.1271.33.1.2.2271.33.3.2.1271.39.4.6.5mIL31-CEE1113213253014133612c108smIL311961171248951904333255140\n\n\nHowever, I realized that the table row is more relevant, so I will reformat it to include only the relevant rows:\n\n\nmIL31-CEE1    13    21    32    50    14\nc108smIL31    19    61    17    124    89 \nmIL31-CEE1    13    21    32    50    14\nc108smIL31    19    61    17    124    89 \nmIL31-CEE1    12    13    25    30    14\nc108smIL31    33    25    140    95    40 \n\n\nLet me reformat it again to make it clear:\n\n\nmIL-31-CEE, 271.9.4.2.6, IC50: 13 ng/mL\nmIL-31-CEE, 271.26.6.6.1, IC50: 21 ng/mL\nmIL-31-CEE, 271.33.1.2.2, IC50: 32 ng/mL\nmIL-31-CEE, 271.33.3.2.1, IC50: 50 ng/mL\nmIL-31-CEE, 271.39.4.6.5, IC50: 14 ng/mL\nc108smIL-31, 271.9.4.2.6, IC50: 19 ng/mL\nc108smIL-31, 271.26.6.6.1, IC50: 61 ng/mL\nc108smIL-31, 271.33.1.2.2, IC50: 17 ng/mL\nc108smIL-31, 271.33.3.2.1, IC50: 124 ng/mL\nc108smIL-31, 271.39.4.6.5, IC50: 89 ng/mL"
    },
    {
        "molecule_name": "mIL-31-CEE",
        "protein_target_name": "IL-31",
        "protein_uniprot_id": null,
        "protein_seq_id": "271.33.3.2.1",
        "binding_metric": "IC50",
        "value": "50",
        "unit": "ng/mL",
        "raw_mentions": "Here are the extracted sentences/rows that meet the criteria:\n\n\nmIL-31 version of mIL-31 supporting the conclusion from the epitope binning studies that this antibody in all likelihood has a different epitope specificity than the other four mAbs, with IC50 values determined using Softmax software (Molecular Devices).\nTABLE 1In Vitro Cell-Based Neutralization Activity of Rat Anti-Mouse IL-31 MAbsmIL-31Conc.IC50 (ng/mL) for mAbsversion(ng/mL)271.9.4.2.6271.26.6.6.1271.33.1.2.2271.33.3.2.1271.39.4.6.5mIL31-CEE1113213253014133612c108smIL311961171248951904333255140\n\n\nHowever, I realized that the table row is more relevant, so I will reformat it to include only the relevant rows:\n\n\nmIL31-CEE1    13    21    32    50    14\nc108smIL31    19    61    17    124    89 \nmIL31-CEE1    13    21    32    50    14\nc108smIL31    19    61    17    124    89 \nmIL31-CEE1    12    13    25    30    14\nc108smIL31    33    25    140    95    40 \n\n\nLet me reformat it again to make it clear:\n\n\nmIL-31-CEE, 271.9.4.2.6, IC50: 13 ng/mL\nmIL-31-CEE, 271.26.6.6.1, IC50: 21 ng/mL\nmIL-31-CEE, 271.33.1.2.2, IC50: 32 ng/mL\nmIL-31-CEE, 271.33.3.2.1, IC50: 50 ng/mL\nmIL-31-CEE, 271.39.4.6.5, IC50: 14 ng/mL\nc108smIL-31, 271.9.4.2.6, IC50: 19 ng/mL\nc108smIL-31, 271.26.6.6.1, IC50: 61 ng/mL\nc108smIL-31, 271.33.1.2.2, IC50: 17 ng/mL\nc108smIL-31, 271.33.3.2.1, IC50: 124 ng/mL\nc108smIL-31, 271.39.4.6.5, IC50: 89 ng/mL"
    },
    {
        "molecule_name": "mIL-31-CEE",
        "protein_target_name": "IL-31",
        "protein_uniprot_id": null,
        "protein_seq_id": "271.39.4.6.5",
        "binding_metric": "IC50",
        "value": "14",
        "unit": "ng/mL",
        "raw_mentions": "Here are the extracted sentences/rows that meet the criteria:\n\n\nmIL-31 version of mIL-31 supporting the conclusion from the epitope binning studies that this antibody in all likelihood has a different epitope specificity than the other four mAbs, with IC50 values determined using Softmax software (Molecular Devices).\nTABLE 1In Vitro Cell-Based Neutralization Activity of Rat Anti-Mouse IL-31 MAbsmIL-31Conc.IC50 (ng/mL) for mAbsversion(ng/mL)271.9.4.2.6271.26.6.6.1271.33.1.2.2271.33.3.2.1271.39.4.6.5mIL31-CEE1113213253014133612c108smIL311961171248951904333255140\n\n\nHowever, I realized that the table row is more relevant, so I will reformat it to include only the relevant rows:\n\n\nmIL31-CEE1    13    21    32    50    14\nc108smIL31    19    61    17    124    89 \nmIL31-CEE1    13    21    32    50    14\nc108smIL31    19    61    17    124    89 \nmIL31-CEE1    12    13    25    30    14\nc108smIL31    33    25    140    95    40 \n\n\nLet me reformat it again to make it clear:\n\n\nmIL-31-CEE, 271.9.4.2.6, IC50: 13 ng/mL\nmIL-31-CEE, 271.26.6.6.1, IC50: 21 ng/mL\nmIL-31-CEE, 271.33.1.2.2, IC50: 32 ng/mL\nmIL-31-CEE, 271.33.3.2.1, IC50: 50 ng/mL\nmIL-31-CEE, 271.39.4.6.5, IC50: 14 ng/mL\nc108smIL-31, 271.9.4.2.6, IC50: 19 ng/mL\nc108smIL-31, 271.26.6.6.1, IC50: 61 ng/mL\nc108smIL-31, 271.33.1.2.2, IC50: 17 ng/mL\nc108smIL-31, 271.33.3.2.1, IC50: 124 ng/mL\nc108smIL-31, 271.39.4.6.5, IC50: 89 ng/mL"
    },
    {
        "molecule_name": "c108smIL-31",
        "protein_target_name": "IL-31",
        "protein_uniprot_id": null,
        "protein_seq_id": "271.9.4.2.6",
        "binding_metric": "IC50",
        "value": "19",
        "unit": "ng/mL",
        "raw_mentions": "Here are the extracted sentences/rows that meet the criteria:\n\n\nmIL-31 version of mIL-31 supporting the conclusion from the epitope binning studies that this antibody in all likelihood has a different epitope specificity than the other four mAbs, with IC50 values determined using Softmax software (Molecular Devices).\nTABLE 1In Vitro Cell-Based Neutralization Activity of Rat Anti-Mouse IL-31 MAbsmIL-31Conc.IC50 (ng/mL) for mAbsversion(ng/mL)271.9.4.2.6271.26.6.6.1271.33.1.2.2271.33.3.2.1271.39.4.6.5mIL31-CEE1113213253014133612c108smIL311961171248951904333255140\n\n\nHowever, I realized that the table row is more relevant, so I will reformat it to include only the relevant rows:\n\n\nmIL31-CEE1    13    21    32    50    14\nc108smIL31    19    61    17    124    89 \nmIL31-CEE1    13    21    32    50    14\nc108smIL31    19    61    17    124    89 \nmIL31-CEE1    12    13    25    30    14\nc108smIL31    33    25    140    95    40 \n\n\nLet me reformat it again to make it clear:\n\n\nmIL-31-CEE, 271.9.4.2.6, IC50: 13 ng/mL\nmIL-31-CEE, 271.26.6.6.1, IC50: 21 ng/mL\nmIL-31-CEE, 271.33.1.2.2, IC50: 32 ng/mL\nmIL-31-CEE, 271.33.3.2.1, IC50: 50 ng/mL\nmIL-31-CEE, 271.39.4.6.5, IC50: 14 ng/mL\nc108smIL-31, 271.9.4.2.6, IC50: 19 ng/mL\nc108smIL-31, 271.26.6.6.1, IC50: 61 ng/mL\nc108smIL-31, 271.33.1.2.2, IC50: 17 ng/mL\nc108smIL-31, 271.33.3.2.1, IC50: 124 ng/mL\nc108smIL-31, 271.39.4.6.5, IC50: 89 ng/mL"
    },
    {
        "molecule_name": "c108smIL-31",
        "protein_target_name": "IL-31",
        "protein_uniprot_id": null,
        "protein_seq_id": "271.26.6.6.1",
        "binding_metric": "IC50",
        "value": "61",
        "unit": "ng/mL",
        "raw_mentions": "Here are the extracted sentences/rows that meet the criteria:\n\n\nmIL-31 version of mIL-31 supporting the conclusion from the epitope binning studies that this antibody in all likelihood has a different epitope specificity than the other four mAbs, with IC50 values determined using Softmax software (Molecular Devices).\nTABLE 1In Vitro Cell-Based Neutralization Activity of Rat Anti-Mouse IL-31 MAbsmIL-31Conc.IC50 (ng/mL) for mAbsversion(ng/mL)271.9.4.2.6271.26.6.6.1271.33.1.2.2271.33.3.2.1271.39.4.6.5mIL31-CEE1113213253014133612c108smIL311961171248951904333255140\n\n\nHowever, I realized that the table row is more relevant, so I will reformat it to include only the relevant rows:\n\n\nmIL31-CEE1    13    21    32    50    14\nc108smIL31    19    61    17    124    89 \nmIL31-CEE1    13    21    32    50    14\nc108smIL31    19    61    17    124    89 \nmIL31-CEE1    12    13    25    30    14\nc108smIL31    33    25    140    95    40 \n\n\nLet me reformat it again to make it clear:\n\n\nmIL-31-CEE, 271.9.4.2.6, IC50: 13 ng/mL\nmIL-31-CEE, 271.26.6.6.1, IC50: 21 ng/mL\nmIL-31-CEE, 271.33.1.2.2, IC50: 32 ng/mL\nmIL-31-CEE, 271.33.3.2.1, IC50: 50 ng/mL\nmIL-31-CEE, 271.39.4.6.5, IC50: 14 ng/mL\nc108smIL-31, 271.9.4.2.6, IC50: 19 ng/mL\nc108smIL-31, 271.26.6.6.1, IC50: 61 ng/mL\nc108smIL-31, 271.33.1.2.2, IC50: 17 ng/mL\nc108smIL-31, 271.33.3.2.1, IC50: 124 ng/mL\nc108smIL-31, 271.39.4.6.5, IC50: 89 ng/mL"
    },
    {
        "molecule_name": "c108smIL-31",
        "protein_target_name": "IL-31",
        "protein_uniprot_id": null,
        "protein_seq_id": "271.33.1.2.2",
        "binding_metric": "IC50",
        "value": "17",
        "unit": "ng/mL",
        "raw_mentions": "Here are the extracted sentences/rows that meet the criteria:\n\n\nmIL-31 version of mIL-31 supporting the conclusion from the epitope binning studies that this antibody in all likelihood has a different epitope specificity than the other four mAbs, with IC50 values determined using Softmax software (Molecular Devices).\nTABLE 1In Vitro Cell-Based Neutralization Activity of Rat Anti-Mouse IL-31 MAbsmIL-31Conc.IC50 (ng/mL) for mAbsversion(ng/mL)271.9.4.2.6271.26.6.6.1271.33.1.2.2271.33.3.2.1271.39.4.6.5mIL31-CEE1113213253014133612c108smIL311961171248951904333255140\n\n\nHowever, I realized that the table row is more relevant, so I will reformat it to include only the relevant rows:\n\n\nmIL31-CEE1    13    21    32    50    14\nc108smIL31    19    61    17    124    89 \nmIL31-CEE1    13    21    32    50    14\nc108smIL31    19    61    17    124    89 \nmIL31-CEE1    12    13    25    30    14\nc108smIL31    33    25    140    95    40 \n\n\nLet me reformat it again to make it clear:\n\n\nmIL-31-CEE, 271.9.4.2.6, IC50: 13 ng/mL\nmIL-31-CEE, 271.26.6.6.1, IC50: 21 ng/mL\nmIL-31-CEE, 271.33.1.2.2, IC50: 32 ng/mL\nmIL-31-CEE, 271.33.3.2.1, IC50: 50 ng/mL\nmIL-31-CEE, 271.39.4.6.5, IC50: 14 ng/mL\nc108smIL-31, 271.9.4.2.6, IC50: 19 ng/mL\nc108smIL-31, 271.26.6.6.1, IC50: 61 ng/mL\nc108smIL-31, 271.33.1.2.2, IC50: 17 ng/mL\nc108smIL-31, 271.33.3.2.1, IC50: 124 ng/mL\nc108smIL-31, 271.39.4.6.5, IC50: 89 ng/mL"
    },
    {
        "molecule_name": "c108smIL-31",
        "protein_target_name": "IL-31",
        "protein_uniprot_id": null,
        "protein_seq_id": "271.33.3.2.1",
        "binding_metric": "IC50",
        "value": "124",
        "unit": "ng/mL",
        "raw_mentions": "Here are the extracted sentences/rows that meet the criteria:\n\n\nmIL-31 version of mIL-31 supporting the conclusion from the epitope binning studies that this antibody in all likelihood has a different epitope specificity than the other four mAbs, with IC50 values determined using Softmax software (Molecular Devices).\nTABLE 1In Vitro Cell-Based Neutralization Activity of Rat Anti-Mouse IL-31 MAbsmIL-31Conc.IC50 (ng/mL) for mAbsversion(ng/mL)271.9.4.2.6271.26.6.6.1271.33.1.2.2271.33.3.2.1271.39.4.6.5mIL31-CEE1113213253014133612c108smIL311961171248951904333255140\n\n\nHowever, I realized that the table row is more relevant, so I will reformat it to include only the relevant rows:\n\n\nmIL31-CEE1    13    21    32    50    14\nc108smIL31    19    61    17    124    89 \nmIL31-CEE1    13    21    32    50    14\nc108smIL31    19    61    17    124    89 \nmIL31-CEE1    12    13    25    30    14\nc108smIL31    33    25    140    95    40 \n\n\nLet me reformat it again to make it clear:\n\n\nmIL-31-CEE, 271.9.4.2.6, IC50: 13 ng/mL\nmIL-31-CEE, 271.26.6.6.1, IC50: 21 ng/mL\nmIL-31-CEE, 271.33.1.2.2, IC50: 32 ng/mL\nmIL-31-CEE, 271.33.3.2.1, IC50: 50 ng/mL\nmIL-31-CEE, 271.39.4.6.5, IC50: 14 ng/mL\nc108smIL-31, 271.9.4.2.6, IC50: 19 ng/mL\nc108smIL-31, 271.26.6.6.1, IC50: 61 ng/mL\nc108smIL-31, 271.33.1.2.2, IC50: 17 ng/mL\nc108smIL-31, 271.33.3.2.1, IC50: 124 ng/mL\nc108smIL-31, 271.39.4.6.5, IC50: 89 ng/mL"
    },
    {
        "molecule_name": "c108smIL-31",
        "protein_target_name": "IL-31",
        "protein_uniprot_id": null,
        "protein_seq_id": "271.39.4.6.5",
        "binding_metric": "IC50",
        "value": "89",
        "unit": "ng/mL",
        "raw_mentions": "Here are the extracted sentences/rows that meet the criteria:\n\n\nmIL-31 version of mIL-31 supporting the conclusion from the epitope binning studies that this antibody in all likelihood has a different epitope specificity than the other four mAbs, with IC50 values determined using Softmax software (Molecular Devices).\nTABLE 1In Vitro Cell-Based Neutralization Activity of Rat Anti-Mouse IL-31 MAbsmIL-31Conc.IC50 (ng/mL) for mAbsversion(ng/mL)271.9.4.2.6271.26.6.6.1271.33.1.2.2271.33.3.2.1271.39.4.6.5mIL31-CEE1113213253014133612c108smIL311961171248951904333255140\n\n\nHowever, I realized that the table row is more relevant, so I will reformat it to include only the relevant rows:\n\n\nmIL31-CEE1    13    21    32    50    14\nc108smIL31    19    61    17    124    89 \nmIL31-CEE1    13    21    32    50    14\nc108smIL31    19    61    17    124    89 \nmIL31-CEE1    12    13    25    30    14\nc108smIL31    33    25    140    95    40 \n\n\nLet me reformat it again to make it clear:\n\n\nmIL-31-CEE, 271.9.4.2.6, IC50: 13 ng/mL\nmIL-31-CEE, 271.26.6.6.1, IC50: 21 ng/mL\nmIL-31-CEE, 271.33.1.2.2, IC50: 32 ng/mL\nmIL-31-CEE, 271.33.3.2.1, IC50: 50 ng/mL\nmIL-31-CEE, 271.39.4.6.5, IC50: 14 ng/mL\nc108smIL-31, 271.9.4.2.6, IC50: 19 ng/mL\nc108smIL-31, 271.26.6.6.1, IC50: 61 ng/mL\nc108smIL-31, 271.33.1.2.2, IC50: 17 ng/mL\nc108smIL-31, 271.33.3.2.1, IC50: 124 ng/mL\nc108smIL-31, 271.39.4.6.5, IC50: 89 ng/mL"
    }
]